{"constraints":[],"fact_domains":{"mutation.out_of_frame_count":[0],"report.101.exists":[false],"report.101.matches_db":[false],"student.101.marks":[85],"student.101.matching_count":[1],"trace.validation_before_update":[true]},"max_worlds":8192,"model_id":"model.reference.02_missing_report","schema_version":"1.0"}
